{
  "semgraph": "movingWindowMedian",
  "metric": "creditLeads",
  "title": "Kredietleads per dag (voorbeelddata)",
  "measureType": "additive",
  "window": 7,
  "spread": "iqr",
  "horizon": 28,
  "format": "svg",
  "locale": "nl-BE",
  "context": {
    "domain": "Leads",
    "dataset": "creditLeads",
    "reliability": "voorbeelddata"
  },
  "data": [
    { "day": "2026-08-22", "value": 30 },
    { "day": "2026-08-23", "value": 26 },
    { "day": "2026-08-24", "value": 49 },
    { "day": "2026-08-25", "value": 49 },
    { "day": "2026-08-26", "value": 42 },
    { "day": "2026-08-27", "value": 51 },
    { "day": "2026-08-28", "value": 50 },
    { "day": "2026-08-29", "value": 24 },
    { "day": "2026-08-30", "value": 20 },
    { "day": "2026-08-31", "value": 50 },
    { "day": "2026-09-01", "value": 49 },
    { "day": "2026-09-02", "value": 49 },
    { "day": "2026-09-03", "value": 51 },
    { "day": "2026-09-04", "value": 43 },
    { "day": "2026-09-05", "value": 26 },
    { "day": "2026-09-06", "value": 26 },
    { "day": "2026-09-07", "value": 50 },
    { "day": "2026-09-08", "value": 47 },
    { "day": "2026-09-09", "value": 44 },
    { "day": "2026-09-10", "value": 46 },
    { "day": "2026-09-11", "value": 51 },
    { "day": "2026-09-12", "value": 36 },
    { "day": "2026-09-13", "value": 25 },
    { "day": "2026-09-14", "value": 48 },
    { "day": "2026-09-15", "value": 46 },
    { "day": "2026-09-16", "value": 45 },
    { "day": "2026-09-17", "value": 51 },
    { "day": "2026-09-18", "value": 49 },
    { "day": "2026-09-19", "value": 31 },
    { "day": "2026-09-20", "value": 22 },
    { "day": "2026-09-21", "value": 50 },
    { "day": "2026-09-22", "value": 49 },
    { "day": "2026-09-23", "value": 54 },
    { "day": "2026-09-24", "value": 48 },
    { "day": "2026-09-25", "value": 56 },
    { "day": "2026-09-26", "value": 30 },
    { "day": "2026-09-27", "value": 30 },
    { "day": "2026-09-28", "value": 49 },
    { "day": "2026-09-29", "value": 56 },
    { "day": "2026-09-30", "value": 52 }
  ]
}
